{
  "type": "apex-gusset",
  "title": "Apex Gusset",
  "version": 1,
  "componentRefs": [
    "design-status",
    "dual-member-gusset"
  ],
  "recipe": [
    "design-status",
    "dual-member-gusset"
  ],
  "interfaces": [
    {
      "role": "main",
      "auto": {
        "type": "member-end-face"
      }
    },
    {
      "role": "secondary",
      "auto": {
        "type": "member-end-face"
      }
    }
  ],
  "presets": {
    "apex_gusset_m16_2x2": {
      "id": "apex_gusset_m16_2x2",
      "version": "0.1.0",
      "name": "Apex gusset, M16 2+2",
      "parameters": {
        "plate": {
          "thickness": 10,
          "width": 420,
          "height": 250,
          "verticalOffset": 0
        },
        "bolts": {
          "fastenerRef": "M16_8_8",
          "rows": 2,
          "pitch": 80,
          "groupSpacing": 220,
          "length": 80
        },
        "holes": {
          "diameter": 18,
          "memberDepth": 35,
          "type": "round"
        },
        "designAssumptions": {
          "standard": "EN 1993-1-8",
          "status": "not-calculated"
        },
        "loads": {
          "status": "not-defined"
        }
      }
    }
  },
  "$schema": "../../../../../app/schemas/connection.schema.json"
}
