{
  "type": "base-plate",
  "title": "Base Plate",
  "version": 1,
  "componentRefs": [
    "design-status",
    "base-plate"
  ],
  "recipe": [
    "design-status",
    "base-plate"
  ],
  "interfaces": [
    {
      "role": "main",
      "auto": {
        "type": "member-end-face"
      }
    },
    {
      "role": "secondary",
      "auto": {
        "type": "member-end-face"
      }
    }
  ],
  "presets": {
    "column_base_plate_m16_2x2": {
      "id": "column_base_plate_m16_2x2",
      "version": "0.1.0",
      "name": "Base plate, M16 2x2",
      "parameters": {
        "plate": {
          "thickness": 16,
          "width": 360,
          "depth": 360,
          "offset": 0
        },
        "anchors": {
          "fastenerRef": "M16_8_8",
          "rows": 2,
          "columns": 2,
          "pitch": 240,
          "gauge": 240,
          "length": 100
        },
        "holes": {
          "diameter": 18,
          "supportDepth": 80,
          "type": "round"
        },
        "washers": {
          "head": true,
          "nut": true
        },
        "welds": {
          "column": 6
        },
        "designAssumptions": {
          "standard": "EN 1993-1-8",
          "status": "not-calculated"
        },
        "loads": {
          "status": "not-defined"
        }
      }
    }
  },
  "$schema": "../../../../../app/schemas/connection.schema.json"
}
